,2011,2010
Beginning balance,"$156,925","$218,040"
Gross increases in unrecognized tax benefits – prior year tax positions,"11,901","9,580"
Gross decreases in unrecognized tax benefits – prior year tax positions,"(4,154)","(7,104)"
Gross increases in unrecognized tax benefits – current year tax positions,"32,420","15,108"
Settlements with taxing authorities,"(29,101)","(70,484)"
Lapse of statute of limitations,"(3,825)","(7,896)"
Foreign exchange gains and losses,(559),(319)
Ending balance,"$163,607","$156,925"
