Trusts,Face Value,Maturity  Date,Annual Interest Rate
ETBH Capital Trust II,"$5,000",2031,10.25%
ETBH Capital Trust I,"20,000",2031,3.75% above 6-month LIBOR
"ETBH Capital Trust V, VI, VIII","51,000",2032,3.25%-3.65% above 3-month LIBOR
"ETBH Capital Trust VII, IX—XII","65,000",2033,3.00%-3.30% above 3-month LIBOR
"ETBH Capital Trust XIII—XVIII, XX","77,000",2034,2.45%-2.90% above 3-month LIBOR
"ETBH Capital Trust XIX, XXI, XXII","60,000",2035,2.20%-2.40% above 3-month LIBOR
ETBH Capital Trust XXIII—XXIV,"45,000",2036,2.10% above 3-month LIBOR
ETBH Capital Trust XXV—XXX,"110,000",2037,1.90%-2.00% above 3-month LIBOR
Total,"$433,000",,
