,"Years ended December 31,"
Cash Flow Data,2014,2013,2012
"Net income, adjusted to reconcile net income to net cashprovided by operating activities<sup>1</sup>",$831.2,$598.4,$697.2
Net cash used in working capital ²,(131.1),(9.6),(293.2)
Changes in other non-current assets and liabilities using cash,(30.6),4.1,(46.8)
Net cash provided by operating activities,$669.5,$592.9,$357.2
Net cash used in investing activities,(200.8),(224.5),(210.2)
Net cash (used in) provided by financing activities,(343.9),"(1,212.3)",131.3
