"Year ended December 31,(in millions, except rates)",2016,2015,2014
Net interest income – managed basis<sup>(a)(b)</sup>,"$47,292","$44,620","$44,619"
Less: CIB Markets net interest income<sup>(c)</sup>,"6,334","5,298","6,032"
Net interest income excluding CIB Markets<sup>(a)</sup>,"$40,958","$39,322","$38,587"
Average interest-earning assets,"$2,101,604","$2,088,242","$2,049,093"
Less: Average CIB Markets interest-earning assets<sup>(c)</sup>,"520,307","510,292","522,989"
Average interest-earning assets excluding CIB Markets,"$1,581,297","$1,577,950","$1,526,104"
Net interest yield on average interest-earning assets – managed basis,2.25%,2.14%,2.18%
Net interest yield on average CIB Markets interest-earning assets<sup>(c)</sup>,1.22,1.04,1.15
Net interest yield on average interest-earning assets excluding CIB Markets,2.59%,2.49%,2.53%
