"Year ended December 31,(in millions, except rates)",2018,2017,2016
Net interest income – managed basis<sup>(a)(b)</sup>,"$55,687","$51,410","$47,292"
Less: CIB Markets net interest income<sup>(c)</sup>,"3,087","4,630","6,334"
Net interest income excluding CIB Markets<sup>(a)</sup>,"$52,600","$46,780","$40,958"
Average interest-earning assets,"$2,229,188","$2,180,592","$2,101,604"
Less: Average CIB Markets interest-earning assets<sup>(c)</sup>,"609,635","540,835","520,307"
Average interest-earning assets excluding CIB Markets,"$1,619,553","$1,639,757","$1,581,297"
Net interest yield on average interest-earning assets – managed basis,2.50%,2.36%,2.25%
Net interest yield on average CIB Markets interest-earning assets<sup>(c)</sup>,0.51,0.86,1.22
Net interest yield on average interest-earning assets excluding CIB Markets,3.25%,2.85%,2.59%
