"Year ended December 31,(in millions, except rates)",2015,2014,2013
Net interest income – managed basis<sup>(a)(b)</sup>,"$44,620","$44,619","$44,016"
Less: Markets-based net interest income,"4,813","5,552","5,492"
Net interest income excluding markets<sup>(a)</sup>,"$39,807","$39,067","$38,524"
Average interest-earning assets,"$2,088,242","$2,049,093","$1,970,231"
Less: Average markets-based interest-earning assets,"493,225","510,261","504,218"
Average interest-earning assets excluding markets,"$1,595,017","$1,538,832","$1,466,013"
Net interest yield on average interest-earning assets – managed basis,2.14%,2.18%,2.23%
Net interest yield on average markets-based interest-earning assets,0.97,1.09,1.09
Net interest yield on average interest-earning assets excluding markets,2.50%,2.54%,2.63%
