,2017,2016,2015
Net Income,"$4,910","$3,431","$4,844"
Non-cash operating activities<sup>(1)</sup>,"5,776","6,444","4,122"
Pension and postretirement plan contributions (UPS-sponsored plans),"(7,794)","(2,668)","(1,229)"
Hedge margin receivables and payables,(732),(142),170
Income tax receivables and payables,(550),(505),(6)
Changes in working capital and other non-current assets and liabilities,(178),(62),(418)
Other operating activities,47,(25),(53)
Net cash from operating activities,"$1,479","$6,473","$7,430"
